{
    "method": "GET",
    "url": "https://api.gravitee.io/echo",
    "headers": [ {
        "name": "X-Gravitee-Request-Id",
        "value": "{#request.id}"
    }],
    "variables": [{
        "name": "my-server",
        "value": "{#jsonPath(#calloutResponse.content, '$.headers.X-Forwarded-Server')}"
    }],
    "exitOnError": true
}
